original_response_(S1),predicted_response_(S2),Grammatically_correctness_of_S2 (scale 1-5),Similarity_between_S1_and_S2_in_terms_of_meaning_and_provided_info (scale 1-5)
the event is on sunday at 6pm in conference_room_102 and management will be attending,ointment is at 10am on the_15th,2,1
no problem goodbye,inoffic is at 50pm on the_15th,1,1
the agenda for your meeting is to discuss_the_merger,your meeting is on friday at 11am,4,3
your meeting is on wednesday at 3pm in conference_room_100,your meeting is in conference_room_100 with the executive_team to go over the budget,2,3
you re welcome,iring_team is in conference_room_100 with the executive_team to discuss_the_,3,1
tom lives at 580_van_ness_ave,tom s house is 6_miles away at 580_van_ness_ave,4,3
i did you re welcome,oin_street,1,1
which one i have two one with your father on the_3rd and one with tom on the_9th,for which one would you like to know i have one on thursday and one on friday,2,3
the appointment on the_9th is at 3pm,you re welcome,5,1
this week the highest_temperature in cleveland will be 100f on saturday,it will be 60f in cleveland on tuesday,4,1
you re welcome,it will be 30f on tuesday,3,1
what city do you want the weather for,you would like to know what the weather is like for what city,4,3
this week in cleveland the weather will be clear_skies on monday dew on tuesday stormy on wednesday drizzle on thrusday cloudy on friday overcast on saturday and raining on sunday,you would like to know what the weather is like for what city,4,3
you re very welcome,frost is predicted to fall on tuesday in cleveland,3,1
home is where is your heart is at 56_cadwell_street,home is 5671_barringer_street,4,1
you are 3_miles away from home with heavy_traffic noted,barringer_street we re 2_miles away from home and there is a car_,3,1
you are welcome driver,you re welcome,5,5
glad to help,you re welcome,5,5
your dinner reservation is at 5pm,your dinner is scheduled at 5pm,4,3
what city are you interested in,what city are you wanting the temperature for,3,3
the temperature in compton will be between 70f and 100f on monday and friday during the other days of the week it will remain between 30f and 70f,what city are you wanting the temperature for,4,1
you re very welcome,you re welcome,5,5
you have four football_activity scheduled one on monday at 6pm with alex one on the_13th at 9am with alex one on wednesday at 1pm with jeff and one on saturday at 5pm with ana,you have two football_activity scheduled one on the_10th with jon and another on the,2,3
you re welcome,braidsnicnicnicnicnicnicnic on the_20th with your mother,1,1
in los_angeles it is gonna be warm on tuesday,it will not be warm in los_angeles,5,1
anytime,you re welcome,5,5
yes i have one listed that is 1_miles away,there is stanford_oval_parking it s 4_miles away does it sound,4,1
then let s go at palo_alto_garage_r i sent the info on your screen,parking is 2_miles away,5,1
you are welcome,you re welcome,5,5
it will not be humid in fresno next_week,it will not be humid in fresno next_week,5,5
anytime,fresno saturday and sunday should not be humid in fresno,2,1
you have 3 optometrist_appointment scheduled one with marie on the_2nd martha on saturday and your brother on the_16th,you have two optometrist_appointment scheduled one on tuesday with alex and the other,2,3
you re welcome,iesheduled to you have aero_ave and sunday with martha,2,1
on friday on san_francisco the weather will be dry with a high of 80f,there will be clear_skies in san_francisco on friday,3,3
anytime,yor welcome,5,5
i ve set the gps to stanford_shopping_center 773_alger_dr it s 2_miles away,the nearest shopping mall is midtown_shopping_center it s 4_miles away,4,3
you re welcome,the nearest shopping mall is midland_shopping_center,3,1
what location would you like the weather information for,what city would you like to find out if there are clear_skies in,3,3
today in san_jose there will be an overcast co clear_skies,there are clear_skies in san_jose today,4,3
no problem,no there is no_traffic in this moment,4,1
what days are you interested in,what days are you interested in,3,5
it will be stormy on monday the lowest_temperature on tuesday hot on wednesday the hottest temperatures on thursday and friday snow on saturday and clear_skies on sunday in durham,what city would you like the weather report for,4,1
you are welcome,traffic on wednesday,3,1
it appears as if there will be a low of 40f and a high of 50f,manhattan s temperature will be a low of 30f and a high of 40f on wednesday,3,2
you re welcome,you re welcome,5,5
the travelers_lodge is closest to you at 6_miles away in moderate_traffic would you like directions there,there are the four_seasons hotel 2_miles away and the_westin 5_,3,1
i m setting the gps for 333_arbol_dr,the_westin is located at 329_el_camino_real,3,2
you are welcome,castnicnicole_foods 3_miles away,4,1
stanford_express_care is nearby,stanford_childrens_health is at 899_ames_ct 4_miles away,3,1
does stanford_express_care have heavy_traffic nearby,appointment is on friday at 899_ames_ct,4,1
the route to stanford_express_care does have heavy_traffic,appointment is on the_10th at 6pm,1,1
yes stanford_childrens_health is 1_miles away with no_traffic do you want the address,bravenswood_city and sunday,1,1
i m sorry i did and i sent the address on your screen drive carefully,braffic is low of 20f and high of 40f,1,1
navigating you to town_and_country,there is town_and_country 5_miles away would you like to go there,3,1
setting gps for fastest route with no_traffic,braero_ct you re welcome,4,1
the address is 383_university_ave i sent it on your screen,braero_ct you re welcome,4,1
you re welcome and we should be there soon,nearby,1,1
it is cloudy in redwood_city today,it is not snowing in redwood_city right now,4,3
no it is not snowing in redwood_city today,right now,1,1
happy to help,you re welcome,5,5
what city are you in,what city are you inquiring about,4,3
this week in manhattan the temperature will range from 20f to 100f,you want the weekly temperature for,3,2
i m here to assist you,you re welcome,5,1
did you want the current weather,what would you like to know about the weather in new_york city,4,3
today s weather forecast is foggy the low temperature of 40f and high of 60f,what would you like to know about the weather in new_york city,4,1
not a problem,herton tea and foggy skies are predicted to be cloudy the temperature should be a low of 20,3,1
what city are you wanting to know the temperature for,what city are you inquiring about,4,2
the lowest_temperature in fresno this week is predicted to be 60f the highest 100f,what city are you inquiring about,4,1
no problem,center do you want the weather for,1,1
your next meeting is with your boss on the_5th at 2pm,the next meeting is on friday at 1pm with sales_team,3,3
you re welcome,arestoesheduled to be cloudy on friday in compton,1,1
there is not gonna be any blizzard this week in alhambra on tuesday it will rain,there will be snow in alhambra on tuesday,4,1
you are very welcome,there will be no snow in alhambra on tuesday,4,1
there is a safeway 4_miles away,there is one local grocery_store called whole_foods but a car collision is noted nearby,4,1
safeway is located at 452_arcadia_pl with a road_block_nearby,the nearest grocery_store is whole_foods at 819_alma_st,4,1
i sent the fastest route on your gps drive carefully,store is 8_miles away and a road block is being reported,3,1
you re welcome,i m sorry and you re welcome,5,5
currently you are taking_medicine on two occasions one is on the_13th at 4pm with your mother the other is on monday at 11am with marie,you have two medicine events scheduled one on monday at 9am with jon and another on the,2,3
i am unable to locate starbucks there is a coffee_or_tea_place called coupa miles away,i have no starbucks listed as close to you,4,3
coupa is 1_miles away with heavy_traffic it shouldn t take us long it s located at 394_van_ness_ave,the address is 792_bedoin_street i sent it on your screen,5,2
you re welcome,you re welcome,5,5
you have two swimming_activity scheduled one on wednesday at 5pm and the other on the_5th at 4pm,you are scheduled for swimming_activity tomorrow wednesday at 7pm,3,3
no problem,you are welcome,5,1
what city would you like weather information about,today it is only raining in compton and atherton,2,1
yes the forecast calls for rain in new_york today,it is not raining in compton and atherton,4,1
no problem,heart is being reported as low of 40f and high of 60f,3,1
what city shall i check for you,where are you wanting to know the weather for,4,2
today is not humid in exeter it is stormy low of 40f high of 50f,right now,1,1
you re welcome,right now the weather in exeter is drizzle,5,1
i have two which one i have one for the_14th at 6pm and one for the_12th at 7pm,you have three swimming_activity scheduled one on the_4th at 9am another on the_,2,1
anytime,you re welcome,5,5
which city are you wanting to know the weather for,what city are you in,5,4
it will be windy tomorrow in seattle,what city are you in,5,4
you are welcome,Seat well,4,1
on friday the highest_temperature in mountain_view is predicted to be 50f,the high in mountain_view will be 100f on friday,1,1
anytime,you re welcome,5,5
your lab_appointment is at 7pm with jon and another one at 2pm with alex,your lab_appointment is at 4pm with jon,4,3
my pleasure,your lab_appointment is at 10am with your sister,4,1
it is cloudy right now in cleveland,it is not cloudy in cleveland today,4,5
you re welcome,it is not cloudy,5,1
what city do you wanna know if it will snow today,where are you wanting to know if it s going to snow what city,4,3
today is gonna be warm in oakland,ffic is being reported as heavy_traffic,1,1
no problem,arrowhead_way today,1,1
tell me what city you would like to know about snow today,there is no snow in the forecast today,3,1
it will not snow in cleveland today,there is no snow in the forecast today,3,3
you are welcome,no problem,1,1
the travelers_lodge is located 4_miles away at 333_arbol_dr would you like directions there,we re 8_miles away from the_westin,5,1
ok i am setting gps for 333_arbol_dr,the_westin is located at 329_el_camino_real,4,1
you re welcome have a great day,you re welcome,5,5
what city can i give you this weather information for,what city do you want the forecast for,4,3
snow is predicted to fall in san_jose on thursday this week,ffic on its way,1,1
you are very welcome,ln,1,1
monday in fresno will have the highest_temperature of 90f,eroona will be the highest_temperature on tuesday in fresno,3,3
you are welcome,iox,1,1
is there a specific day you would like to know the weather for in new_york,what would you like to know about the weather in new_york,2,3
it will be dry and between 30f - 50f friday in new_york,what days are you interested in,3,1
no problem,what days are you interested in,3,1
what city would you like to know the weather about,what city would you like the weather for,4,3
it is not predicted to drizzle any today or tomorrow in durham,there will be no drizzle in the forecast for today and tomorrow,3,3
anytime,you re welcome,5,5
the palo_alto_medical_foundation is 4_miles away at 611_ames_ave would you like directions there,the closest hospital is stanford_childrens_health,4,1
there is moderate_traffic on our way and you should be able to reach there fast i sent all the info on your screen drive carefully,stanford_childrens_health is the only hospital,3,1
you re welcome,you re welcome,5,5
the weather forecast predicts that it will be stormy in los_angeles on sunday,it will not be windy in los_angeles on sunday,1,4
no problem,inoffic on sunday,4,1
where should i check for snow,please tell me what city i can give you the snow information for,5,3
there will be no snow in corona this week,it is going to snow on wednesday in corona,5,3
no problem my driver,you re welcome,4,1
what city are you wanting to know the weather for,where would you like to hear the forecast from,1,3
tomorrow in seattle is looking warm with a low of 70f and a high of 90f no sign of fog,for what city would you like to know today and tomorrow s forecast,1,1
no problem,inoffic is low of 40f and high of 60f,1,1
the_clement_hotel is 8_miles away at 657_ames_ave,the four_seasons is 4_miles away,4,1
there is currently moderate_traffic on the way to the hotel setting directions now,the address is 465_arcadia_pl i sent it on your screen,4,1
you re welcome,the address is 8_miles away,4,1
for what city would you like today and tomorrow s weather for,where would you like to hear the forecast from,3,3
it will not be foggy in fresno in the coming days,what city would you like the forecast from,3,1
you re welcome,ave,1,1
hacienda_market is the closest grocery_store 1_miles away,there is a safeway 4_miles away,3,2
setting navigation to 1313_chester_ave now there is a road_block_nearby so drive carefully,the address is 819_alma_st and i am setting gps for whole_food,2,1
no problem,farmers_market is located at 819_alma_st,3,1
it will be 80f on tuesday in brentwood,the highest_temperature in brentwood will be high of 80f on monday and sund,1,3
you re very welcome,you re welcome,5,5
the nearest parking_garage is palo_alto_garage_r it s 1_miles away navigate you there,the closest parking_garage is webster_garage at 880_ames_ct there,3,2
i sent the info and the quickest info on your screen you re welcome,the closest route to you will be through heavy_traffic,1,2
the_westin is 4_miles away with moderate_traffic will that help,the only rest_stop is 6_miles away and there is no_traffic,5,1
the_westin is at 329_el_camino_real do you need me to set the navigation,the only rest_stop is 6_miles away the address is 408_university_ave,3,1
navigation set have a great day,nearby,1,1
palo_alto_cafe is 4_miles away and serves coffee and tea do you want the address,i have two locations you could purchase some tea at which would you prefer,2,1
palo alto is located at 436_alger_dr,i prefer to go there,5,1
you re welcome,you re welcome,5,5
there isn t any traffic to pizza_my_heart at 528_anton_ct it will be a 6_miles drive,the closest pizza place is dominos and pizza_hut,5,2
quickest route with no_traffic set for pizza_my_heart have a great day,anton_ct you will be able to reach there shortly,3,1
the nearest one is midtown_shopping_center but there is a road_block_nearby there is also ravenswood_shopping_center 2_miles farther but with no_traffic on its direction,we are 6_miles away from ravenswood_shopping_center would you like me,3,1
setting directions to 434_arastradero_rd,springer_street,1,1
you re welcome always happy to help,springer_street is located at 408_university_ave,4,1
the nearest hotel is hotel_keen it s 3_miles away do you want its address,we re 4_miles away from four_seasons with no_traffic on our way,3,1
578_arbol_dr there is no_traffic and you should arrive in a couple minutes,the nearest hotel is no_traffic on our way,2,1
i picked the best route for you drive carefully,ffic is all set,1,1
you re welcome,you re welcome,5,5
it will not be warm in compton on wednesday,no it will not be warm in compton on wednesday,3,5
anytime,you re welcome,5,5
what city do you want the weather forecast for,what city should i check today s forecast for,4,3
today in downtown_chicago there should be hail with a high of 70f,frost is predicted,2,1
you re welcome,inoffic is noted,1,1
midtown_shopping_center is the closest shopping_center to you would you like the address,we are 5_miles away from town_and_country does it sound good to you,4,3
we re going to 338_alester_ave there is heavy_traffic but it s just 2_miles away,ave you will be able to go over the budget,1,1
sending the address for the midtown_shopping_center at 338_alester_ave to your gps,ffic to whole_foods at 819_alma_st,1,1
you re welcome,you re welcome,5,5
hotel_keen is a rest_stop located 3_miles away there is a car_collision_nearby but should delay you to long,then let s go at the_westin hotel there is no_traffic and it s nearby,5,3
the address for hotel_keen is 578_arbol_dr 3_miles away with a car_collision_nearby,the_westin is at 329_el_camino_real,4,1
i sent the quickest route on your screen,bol_real,1,1
you re welcome drive safely,i sent the quickest route on your screen,5,1
if you drive carefully it will be for sure,braids_market is 2_miles away,4,1
there is no fog in the forecast for exeter next_week,it will not be foggy in exeter on next_week,4,3
you re welcome,it will not be foggy in exeter on next_week,4,1
today you have a 7pm meeting with hr to discuss_the_merger,what day is today,4,1
you are welcome,what day is today,4,1
what city would you like the forecast for,what city can i give you the weather forecast for,3,3
it will be dry today snowy on tuesday dew on wednesday warm on thursday misty on friday snow on saturday and cloudy on sunday in grand_rapids,what city can i give you the weather forecast for,3,3
you re welcome,you re welcome,5,5
in san_mateo it will be stormy on saturday and hail on sunday,it will be snowy in san_mateo on sunday,5,3
you re welcome,braiding frost in san_mateo on sunday,2,1
there will be no drizzle in redwood_city this weekend,there will not be drizzle in redwood_city this weekend,3,3
no problem,there will be rain on saturday in redwood_city,5,1
i have a few chinese_restaurant listed which one would you like to know about,we re 7_miles away from panda_express but there is a car_collision,4,1
p_.f_._changs is 3_miles away but there is currently heavy_traffic on the route panda_express is farther at 4_miles away but there isn t any traffic,miles away,1,1
yes panda_express seems to be the fastest,there is moderate_traffic on our way,3,1
all right navigating to panda_express at 842_arrowhead_way,ffic is already set in the 30_farmers_market,1,1
you re welcome,you re welcome,5,5
you will find pizza_chicago at 915_arbol_dr it is 2_miles away without any traffic,the pizza_hut is located at 704_el_camino_real it is 4,2,3
fastest route being programmed for pizza_chicago,anton_ct you sent the info on your screen,3,1
you re welcome,anton_ct you re welcome,5,1
could you please let me know what place i am looking up the data for,which location are you wanting to know if it s going to be cloudy,1,1
this week boston does not have any weather predictions of it being cloudy,what city do you want the weather for,4,3
no problem my driver,icago which has moderate_traffic,1,1
it will not be windy in atherton in the next_few_days,it will not be windy in atherton in the next two_days,3,3
you re welcome,it will be windy in camarillo on tuesday,4,1
jack lives at 864_almanor_ln,tom s house is 6_miles away at 580_van_ness_ave,5,1
you re welcome,tom s house is 6_miles away at 580_van_ness_ave,5,1
on thursday the temperature in alhambra will be low of 20f and high of 30f,there will be a high of 80f in alhambra on thursday,2,2
happy to help,there will be a high of 90f in alhambra on thursday,2,1
what city are you interested in,what city shall i look the 7 day forecast in,2,3
tomorrow in fresno it will rain,what city shall i look the 7 day forecast in,2,1
no hail in fresno tomorrow there will be rain,eroffic will be low of 20f and high of 40f,1,1
until next time,nearby foggy low of 60f and high of 70f,1,1
for what city would you like to know that,which city would you like the weekend forecast for,4,3
it will be rainy the first half of the week and then foggy the second and dry over the weekend in compton,what city do you want the weather for,2,1
you re welcome,ave and what city do you want the weather for,1,1
what city are you wanting to know the temperature for,what city can i give you the temperature information for,3,4
it will be between 60f - 70f today and 30f - 40f tomorrow in seattle,today in seattle will be low of 40f and high of 50f both today and tomorrow,1,3
no problem,farmers_market is located at 899_ames_ct which is 4_miles away,4,1
you are playing tennis on 11am friday,your tennis game is at 7pm wednesday,3,3
there is moderate_traffic on the 4_miles route home to 56_cadwell_street,navigating you home,3,1
you re welcome drive carefully,you re welcome,5,5
anytime,you re welcome,5,5
your next meeting is monday at 3pm,the next meeting is on friday at 1pm,5,3
your next lab_appointment is next monday at 2pm,there is no scheduled lab_appointment on your calendar would you like me to schedule on for you,4,3
coupa is 5_miles away,we re 2_miles away from coupa and 3_miles away from starbucks do,5,2
i will pick the shortest route available for you don t worry do you want to get the info on your screen,there is a car_collision_nearby do you still want to go,5,1
i sent the route on your screen you re welcome,code_center is located at 394_van_ness_ave,5,1
i do not have info on the local starbucks but i do see another coffee place would you like to hear info on it,there is no starbucks nearby but teavana is located 1_miles away would you like,3,
there is coupa located at 394_van_ness_ave there is moderate_traffic but you re just 6_miles away,bolus tea and tea places near you,2,3
you are welcome,iring tea and tea places within 5_miles,1,1
there is a panda_express 3_miles from you as well as a pizza_hut 5_miles from you,dominos at 776_arastradero_rd is located near you,2,1
panda_express is at 842_arrowhead_way with no_traffic noted,dominos is at 776_arastradero_rd,2,1
i sent the info on your map drive carefully,bucks and tea places,1,1
for which time period did you want weather information,what time period are you interested in,2,3
it is between 50f - 70f in new_york right now,what days are you interested in,3,1
no problem,week with highs in the 90s and lows in the 70s,2,1
where are you wanting to know if it s going to rain or not,what city would you like the forecast for,4,1
it is not going to rain in san_francisco this week,farmers_market is 2_miles away,5,1
no problem,inoffic is 6_miles away,1,1
you have an optometrist_appointment today at 1pm,you have a meeting with the sales_team to discuss_the_company_picnic on fr,3,1
your friends house is on 5677_southwest_4th_street there is moderate_traffic on our way but we re just 1_miles away,i don t see your friend s house in the area home is 6_miles away would you,2,3
it must have been a hard day for you if you don t remember the address of your home 56_cadwell_street i was kidding don t crash me please,your home is at 5671_barringer_street,4,1
you re welcome,you re welcome,5,5
there are no starbucks around here but we re 4_miles away from cafe_venetia is it okay to go there,the nearest starbucks is 6_miles away at 792_bedoin_street,5,3
i sent the address with the fastest route on screen drive carefully,i sent the info on your screen drive carefully,5,3
stanford_express_care is 7_miles away though there is a car_collision_nearby would you like directions there,the nearest hospital is stanford_childrens_health which is 5_miles away but,3,1
okay heading to 214_el_camino_real,it is located at 773_alger_dr we will get to go there shortly,1,1
palo_alto_garage_r is at 481_amaranta_ave,we re 1_miles away from dish_parking and 4_miles away from pal,2,1
i will send on your screen the quickest route sure there is heavy_traffic now and we will have to make the route slightly longer,parking is 2_miles away,5,1
you re welcome we should arrive shortly,you re welcome,5,5
we re 5_miles away from p_.f_._changs do you want to go there,there are mandarin_roots 5_miles away and jing_jing 6_miles,5,3
taking you to p_.f_._changs,ffic,1,1
the addres of p_.f_._changs is 669_el_camino_real,jing_jing and tea_ave,1,1
navigation set we should arrive shortly,inese_traffic to tea_keen,1,1
your swimming_activity is on the_5th with your father,you have three swimming_activity scheduled the one at 5pm is with your brother the other at 7,1,3
happy to help,nesday is with your aunt and the one at 2pm is with martha,1,1
you have two yoga_activity scheduled one on monday at 5pm and another on the_5th at 4pm,you have four yoga_activity scheduled one is on monday at 9am another is on thursday,3,3
have a great day,you re welcome,5,5
trader_joes is 2_miles away at 408_university_ave there is currently heavy_traffic on the route,there is no grocery_store within 3_miles,4,1
setting navigation now there is heavy_traffic on the way so drive carefully,there is no grocery_store,5,1
you re welcome drive safely,you re welcome,5,5
philz serves coffee and is 6_miles away at 583_alester_ave,we are 3_miles away from philz set the gps to go there,3,2
there is no_traffic on the 6_miles route to philz enjoy,cast tea places there,1,1
you re welcome,ln,1,1
the weather in cleveland on thursday will have dew and a high of 30f,ursday in cleveland is gonna be dry with a low of 60f and a high of 70f,1,2
anytime,traffic will be on thursday in cleveland,3,1
home is listed as 56 caldwell street,your home address is 5671_barringer_street,5,1
setting quickest route home now,barringer_street is 5_miles away,5,1
anytime,barringer_street is 6_miles away,5,1
valero is 4_miles away,there is a gas_station 1_miles from your location would you like me to pull it,2,1
valero is at 200_alester_ave,the nearest gas_station is 8_miles away,5,1
i sent the best possible route on screen but there will be heavy_traffic anyway i m sorry,i will find a route to whole_foods for you,5,1
you re welcome,you re welcome,5,5
what city are you interested in,what city are you inquiring about,5,5
the temperature in los_angeles this week reaches a low of 40f and the highest will be 100f,today there is frost in los_angeles with a high of 60f and a low of 40,1,3
you re welcome hope you have a great day,frost is predicted to fall in san_francisco on tuesday,2,1
