original_response_(S1),predicted_response_(S2),Grammatically_correctness_of_S2 (scale 1-5),Similarity_between_S1_and_S2_in_terms_of_meaning_and_provided_info (scale 1-5)
your football_activity is on sunday at 9am with your brother,the football game is friday at 9am,3,3
happy to help,you re welcome,5,5
your doctorappointment at 2pm your aunt will be going,you have two doctorappointment scheduled one is at 2pm with jeff and the other is at,3,4
happy to help,you re welcome,5,5
what city can i give you the weather forecast for,for what city would you like me to do a search today s forecast,2,4
today is gonna be dry on oakland,fortunately there is a car_collision_nearby,3,1
you re welcome,i will try to find the quickest route possible,5,1
for which one i have two one at 7pm the_8th and one at 10am the_1st,your dentist_appointment is on the_13th at 10am,5,2
you re welcome,you re welcome,5,5
you have a conference on the_13th at 9am with hr,your conference is on saturday at 7pm with hr in conference_room_50 to discuss_,2,2
happy to help,ln in conference_room_50 to discuss_the_company_picnic,2,1
your next appointment with your optometrist is tuesday at 11am,your optometrist_appointment is on wednesday,3,3
what city would you like the 7 day forecast for,what city can i give you the weather information for,2,3
it should not be humid in compton next_week,what city do you want the weather for,4,1
anytime,view it s not gonna be humid in next_week,2,1
there is 2 tea shops near you teavana is 4_miles away and cafe_venetia is 5_miles away which one do you want,i have two locations you could purchase some tea at which would you prefer,3,1
teavana is the fastest journey because there is no_traffic on the way there cafe_venetia has moderate_traffic should we go to teavana,there is a car_collision_nearby which is 6_miles away but there is,3,1
i sent on your screen its position and the fastest route to get there,herton_farmers_market and whole_foods,1,1
teavana is located at 145_amherst_st,traffic to whole_foods,3,1
you re welcome glad i could be of assistance,you re welcome,5,5
what city are you asking about,what city are you asking about,5,5
monday will be foggy with low s of 30f and high s of 40f similar heh,it will be cloudy on tuesday in manhattan,5,2
no problem,it will not be cloudy in manhattan this week,5,1
stanford_shopping_center is the only nearby shopping_center,the nearest shopping_center is stanford_shopping_center which is two miles away,4,3
there is a car_collision_nearby stanford_shopping_center,there is no_traffic on our way,3,4
the route to 773_alger_dr set to the quickest possible,i sent the info on your screen,5,1
you re welcome,you re welcome,5,5
there is no starbucks listed locally but i have another coffee shop listed would you like the address to it,the nearest starbucks is 6_miles away at 792_bedoin_street,5,2
then let s go at cafe_venetia 269_alger_dr,the nearest starbucks is 6_miles away at 792_bedoin_street,5,1
the destination is 4_miles away in no_traffic,i m sorry but there are no starbucks nearby if you want there is another coffee shop,2,1
you are welcome,you re welcome,5,5
what city would you like weather information about,what city do you want to hear the rain prediction for,3,4
the weather forecast for oakland does not show rain right now,there is no rain forecast in oakland right now,5,4
you are welcome,inoffic,1,1
what city are you wanting to know if it s going to rain,where would you like to know about the forecast for rain,2,3
it will rain on wednesday in redwood_city,frost is predicted on sunday,3,1
no problem so long,you re welcome,5,1
there is heavy_traffic in this moment but we re just 1_miles away it shouldn t take too long to reach there,there is moderate_traffic on our way but we re just 4_miles away from home,4,1
i sent all the info on your screen drive carefully,setting navigation to 408_university_ave now,3,1
you are welcome,you re welcome,5,5
there is the midtown_shopping_center 3_miles away and no_traffic on the route set this destination on your gps,we are 5_miles away from town_and_country does it sound good to you,3,1
setting gps to midtown_shopping_center anything else,center_farmers_market is located at 773_alger_dr would you like directions,3,1
no problem,springer_street then,1,1
your agenda for your meeting today is go_over_budget,the purpose of the meeting today is to go over the budget,3,4
peets_coffee also serves tea they are 2_miles away at 9981_archuleta_ave,the closest tea shop is coupa which is located at 394_van_ness_ave,4,1
moderate_traffic is listed to peets_coffee,the closest tea shop is coupa which is located at 394_van_ness_ave,4,1
displaying directions now,traffic,1,1
you re welcome drive safely and enjoy,you re welcome,5,5
chef_chu_s is the only chinese_restaurant but here is heavy_traffic,the only chinese_restaurant listed is with heavy_traffic do you still want to,1,3
chef_chu_s is at 593_arrowhead_way,ffic is all set,1,1
there will be heavy_traffic sorry,odge_ness_ave,1,1
you re welcome,you re welcome,5,5
cafe_venetia is 2_miles away at 269_alger_dr,starbucks is 2_miles away,5,3
setting navigation now for the quickest route there is a road_block_nearby so drive carefully,i sent the info on your screen,5,1
anytime,i sent the best route on your screen you re welcome,5,1
it will not be warm in grand_rapids on saturday,it will not be warm in grand_rapids on saturday,5,5
you are welcome,you re welcome,5,5
no problem,it will not be warm in grand_rapids on saturday,5,1
in new_york it will be raining monday and tuesday snowing wednesday windy on thursday frost on friday dew on saturday and overcast on sunday,yes the weather for new_york city this week will be mostly raining with the lowest at 30,2,2
you re welcome patience,cast the lowest route to tuesday and the highest being 100f,1,1
the nearer cafe is cafe_venetia it s 2_miles away and there is a car_collision_nearby,the nearest barista is 5_miles away would you like the address,2,1
i m afraid that cafe_venetia is the best option in this moment i sent on your screen the directions to reach there through another route,threnicnic_market is 7_miles away with no_traffic on our way,2,1
you re welcome drive safely,archuleta_ave and sunday with no_traffic,1,1
the nearest starbucks is 3_miles away there is a road block on its way so i already sent on your screen another route to reach faster,there is a starbucks 4_miles away,5,3
yes it is hope you can have your coffee soon,there is a coupa cafe_venetia 1_miles away,4,1
the starbucks is located at 792_bedoin_street setting navigation now,there is heavy_traffic on the route to starbucks,3,3
you re welcome drive safely and enjoy,there is no_traffic on the route to starbucks,3,1
here are directions to 5672_barringer_street,i don t see 5672_barringer_street nearby can you confirm that that is the,2,4
the only route has heavy_traffic is that alright,taking you to cafe_venetia,5,1
directing to 5672_barringer_street now,castthelessnicnicnicnicnicnicnicnic you got it,1,1
you re welcome and have a great day,lnasa well,1,1
what city are you wanting to know the weather for,what city are you in,1,3
in los_angeles it is going to be hot today with a low of 40f and a high of 60f tomorrow will be rainy with a low of 40f and a high of 60f,what city are you in,1,1
anytime,yor welcome,5,1
coupa is nearby and serves tea,there is a peets_coffee and a teavana close by,3,1
moderate_traffic to coupa,there is a peets_coffee and a teavana close by,3,1
coupa s address is 394_van_ness_ave,the only tea shop is philz and it is 6_miles away,4,1
no but palo_alto_cafe is just 1_miles away and has moderate_traffic so we should be able to get there quicker how does that sound,fortunately there is a car_collision_nearby but i sent on your screen another route to,3,1
ok initiating navigation,do you want to go to coupa or the_venetia,5,1
where would you like to know if it will snow,what city would you like me to check if it will be snowing today,2,2
no it s not forecast to snow in corona today the forecast is humid with a low of 70f and a high of 90f,it will not be snowing today in corona,5,1
you re welcome have a great day,you re welcome,5,5
whole_foods is 4_miles away,trader_joes is 2_miles away,4,1
the quickest route to whole_foods at 819_alma_street does not have any traffic,joes is 6_miles away,4,1
gps set and have a great day,ave,1,1
we re 3_miles away from topanga_mall and there is heavy_traffic on its way,we are 1_miles away from stanford_shopping_center does it sound good,4,1
you will find topanga_mall at 171_oak_rd,the nearest shopping_center is whole_foods which is 6_miles away,3,1
setting navigation now,nearby,1,1
you re welcome drive safely,nearby,1,1
bye,you re welcome,5,3
whole_foods located at 819_alma_st is 1_miles away although there is a car_collision_nearby,there is one nearby grocery_store which is whole_foods on 819_alma_,1,3
the current route is the quickest,the closest grocery_store is whole_foods on 819_alma_st,3,1
you re welcome,you re welcome,5,5
it will be cloudy but not foggy in redwood_city on tuesday,it should not be foggy on tuesday in redwood_city,4,3
glad i could help out,it will not be foggy in redwood_city,5,1
there is a safeway 2_miles away would you like to get its address,the nearest grocery_store is 6_miles away whole_foods at 819_al,3,1
safeway is at 452_arcadia_pl,the nearest grocery_store is whole_foods at 819_alma_st,3,1
the only route has moderate_traffic is that going to be okay,traffic is 20_miles away whole_foods at 819_alma_st,2,1
safeway is the only grocery_store listed it has moderate_traffic will that be ok,inese_restaurant is 1_miles away whole_foods at 819_al,1,1
setting destination now,center_farmers_market,1,1
you re welcome,bol_to_real,1,1
which location do you want to know the current temperature of,what city do you want to know the temperature for,3,2
the temperature in alameda now is low 60f and high 80f,the current temperature for,1,2
you are welcome,you re welcome,5,5
hr will be at the friday meeting,your meeting with the sales_team in on friday at 7pm,5,5
the nearest grocery_store is located 6_miles away at 452_arcadia_pl,the nearest grocery_store is whole_foods 2_miles away at 819 alameda,4,3
safeway is located at 452_arcadia_pl and navigation is set,the address is 819 alameda st,3,1
i did i did you re welcome,bol_to_farmers_market is located at 819 alameda st,3,1
the_4th at 1pm with tom the_10th at 9am with ana the_13th at 9am with your father the_5th at 2pm with alex and the_10th at 4pm with your sister,your dentist_appointment is set for saturday at 11am,4,1
in what city are you asking,what city do you want the weather for,4,4
the temperature in durham will be lowest_temperature low of 70f high of 90f tuesday highest_temperature low of 40f high of 60f thursday,the weather for durham is forecast to be cloudy with a low of 20f and a high of,1,2
you re very welcome,you re welcome,5,5
we re 5_miles away from starbucks do you like their tea,i have a location for a place that serves tea that is 5_miles away you need more,2,2
you will find starbucks at 792_bedoin_street,starbucks is 1_miles away,4,3
you re welcome,ffe tea is 6_miles away,4,1
i m sorry the only route home has heavy_traffic it will be a 7_miles drive to 10_ames_street,home is located at 5671_barringer_street in moderate_traffic setting navigation now,3,1
you re very welcome,condemuled you to home at 10_ames_street,3,1
stanford_express_care is at 214_el_camino_real,the nearest hospital is philz which is located at 583_alester_ave,3,1
good day,anton will be attending your directions with you at 10am,3,1
there is currently snow in san_francisco,today in san_francisco the weather is low of 90f and high of 100f,1,2
happy to help,you re welcome,5,5
there is a travelers_lodge one miles away,there is a four_seasons and the_clement_hotel,1,1
travelers_lodge 333_arbol_dr,the_clement_hotel is located at 657_ames_ave,3,1
gps set for shortest route,eriauled to be cloudy on the_4th at 11am,2,1
have a good day,ave,1,1
the_westin is located 7_miles away with no_traffic setting directions now to 329_el_camino_real,the travelers_lodge is located 5_miles away though there is a road_block_,3,2
setting navigation now,the travelers_lodge is 6_miles away and there is no_traffic,3,1
you re welcome,ave,1,1
there is no starbucks close but there is two others one is coupa that is 6_miles away and the other is cafe_venetia which is 3_miles away which one do you want,i do not have directions for starbucks at this moment,4,3
cafe_venetia is located at 269_alger_drive with heavy_traffic is that going to be okay,herton_ness_ave it s 4_miles away,4,1
i sent the info on your screen drive carefully,hambra_farmers_market and tea_venetia,1,1
you re welcome,uleta_mesa_ave,1,1
the nearest gas_station is located 5_miles away need more info,the nearest one is whole_foods it s 6_miles away and there is a road,3,1
setting gps for quickest route to valero gas_station now,the closest gas_station is 8_miles away and there is a road_block_near,4,1
valero is located at 200_alester_ave,i sent the info on your screen and sorry about the road,4,1
you re welcome glad i could help,ln,1,1
there is valero 7_miles away with moderate_traffic on our way,the nearest gas_station is chevron at 783_arcadia_pl,3,1
valero is at 200_alester_ave,nearby,1,1
there is moderate_traffic on our way i sent the route on your screen,there is no_traffic on our way,3,1
you re welcome,you re welcome,5,5
it will be stormy and hailing in san_francisco in the next two_days,it will be warm today in san_francisco,5,2
no problem,you re welcome,5,3
jill s house is located 5_miles away at 347_alta_mesa_ave,tom s house is 6_miles away at 580_van_ness_ave,3,1
the quickest route is 347_alta_mesa_ave at 5_miles we will be there shortly,velandveland_shopping_center is 6_miles away at 773_alger_,3,1
you re welcome,you re welcome,5,5
your tennis_activity is set for 11am with jon in attendance,your tennis_activity is scheduled for the_2nd at 6pm with,3,3
happy to help,ino,1,1
what city do you want to know if it s going to rain or not,what city would you like the forecast for,3,3
there is no rain in fresno today but it will be cloudy,fresno is forecast to be raining low of 60f and high of 70f today,3,3
you are welcome,fresno is humid the low temperature is 40f and the high is 60f,2,1
there is a shopping_center 3_miles from you the address is 338_alester_ave would you like directions,stanford_shopping_center is 3_miles away,4,2
setting navigation to the midtown_shopping_center there is a car_collision_nearby so drive carefully,it is overcast in grand_rapids right now,3,1
i sent the info on your screen drive carefully,center is 90f - 100f,1,1
palo_alto_medical_foundation at 611_ames_ave is 4_miles away but there is no_traffic on the way setting navigation now,stanford_childrens_health is the only hospital that i can find it is located at 8,2,1
you are welcome,you re welcome,5,5
the temperatures in seattle will be high this week and the hottest days will be monday and tuesday with 100f ( but pay attention it s gonna rain too ),it s not gonna be hot in boston this weekend,4,1
the highs for boston this weekend are in the 90s while the lows are supposed to be 70s,aturday with highs in the 90s and lows in the 50s,2,1
you re welcome glad i could help,ffic will not be hot in boston this weekend,1,1
what location do you want to know if it will snow,please tell me what city i can give you the snow information for,2,2
it will snow on tuesday in mountain_view,president_president is predicted to snow in mountain_view on wednesday,2,1
no problem,traffic is being reported on wednesday in mountain_view,3,1
what city are you interested in,which city do you want the weather for,5,3
it will be cloudy with a low of 90f and a high of 100f in compton on sunday,what city do you want the weather for,5,1
anytime,to which city do you want to know the weather for,5,1
we are 4_miles away from whole_foods and from safeway which one do you prefer,the closest grocery_store is 6_miles away,5,1
safeway is located at 452_arcadia_pl,the closest grocery_store is 2_miles away,5,1
you re all set drive carefully,parking is 6_miles away,3,1
we re 3_miles away from midtown_shopping_center and there is no_traffic on our way,ravenswood_shopping_center is close,5,2
you got it gps set,braero_alto_shopping_center and we should be there shortly,2,1
no problem,you re welcome,5,5
what city do you want the weather for,what city would you like the weather report for,5,3
it will be dry other than sunday and the temperatures are expected to be between 70f - 100f monday and tuesday 30f - 40f wednesday 40f - 60f thursday and 80f - 100f friday to sunday,what city would you like the weather report for,5,2
you are welcome,ino,1,1
what city should i find friday s temperature for,what city do you want the weather for,5,3
on friday there will be clear_skies in alhambra,for what city would you like the temperature for,5,2
it will be between 20f - 30f in alhambra on friday,arbol_dr,1,1
you re welcome,you re welcome,5,5
the closest parking_garage is civic_center_garage located 4_miles away at 270_altaire_walk,the closest parking_garage is dish_parking at 550_alester_ave would you,3,3
you re welcome,nearbyffic,1,1
it will be warm in san_francisco tomorrow it should not be windy,it will not be windy in san_francisco tomorrow,4,3
no problem,you re welcome,5,5
you have 4 doctor_appointment scheduled marie on the_15th your brother on wednesday your mother on the_20th and ana on the_12th,you have two doctor_appointment scheduled one on friday with jeff and the other is on,3,2
my pleasure goodbye,nesday is the only day it will rain in san_francisco,2,1
your conference is set for monday with your boss to go_over_budget,you have two conference scheduled one on the_12th with the infrastructure_team and another on the,2,2
the conference is with your boss,your conference is on monday with the executive_team to go over the quarterly report,3,2
you re welcome don t forget it s held in conference_room_102,you re welcome,5,4
no problem,mesa_ave and john saturday with the executive_team,1,1
what city are you inquiring about,what city can i give you the weather forecast for,4,4
in seattle there is snow right now,there is no snow in the forecast for seattle,3,3
you are most welcome,realizzard is scheduled on wednesday and thursday,1,1
the weather in fresno over the next 48 hours will be cloudy with snow,the weather in fresno the next 48 hours will be misty with a low of 20f and,1,3
you are welcome,condemuled low of 40f and a high of 60f,1,1
what city would you like weather information about,what city are you inquiring about,4,3
in san_jose it is expected to be between 40f - 60f monday and tuesday 70f - 80f wednesday 90f - 100f thursday 70f - 90f friday 30f - 40f saturday and 40f - 60f on sunday,iday is predicted to have the week s temperature for,1,2
you are welcome,icago does not have any weather predictions for,1,1
your tennis match is tuesday at 11am,your tennis_activity is on friday at 11am,4,2
you re very welcome,you re welcome,5,5
your next meeting is on monday at 7pm with the infrastructure_team to go_over_budget,you next meeting is on monday at 1pm hr will be in attendance to go over the budget,4,4
the football game is wednesday at 10am,the football game is friday at 9am,3,4
my pleasure,you re welcome,5,5
there is cafe_venetia that s 4_miles away at 269_alger_dr,the closest is cafe_venetia 3_miles away in heavy_traffic would you,3,3
there is no_traffic on our route i ve set the navigation there,no there is a road_block_nearby but i sent on your screen the best route,4,1
you re welcome,i sent on your screen the best route to reach there,4,1
taking you home,there is no_traffic on our way and you re welcome,5,1
your address is 5671_barringer_street we re 3_miles away from home now,the only route to home is noted with heavy_traffic do you still want to go there,2,1
your gps has been set for home,ln,1,1
you re welcome happy to help,lnumbera_ave i sent the info on your screen,1,1
stanford_shopping_center is 4_miles away,we re 6_miles away from stanford_shopping_center,3,3
ok you will headed toward stanford_shopping_center at 773_alger_dr located 4_miles away,center is reported to be cloudy on any day,2,3
you are welcome,what city do you want the weather for,4,1
what city do you want the weather for,what city would you like me to check the weather forecast for,4,3
in manhattan it will be stormy on wednesday and thursday,it will be stormy on tuesday in manhattan,4,3
anytime,it will not be stormy in manhattan over the next 7 days,4,1
there s a parking_garage 2_miles away would you like the name and address of it,we are 4_miles away from palo_alto_garage_r and there,2,2
navigating to palo_alto_garage_r,mesa_ave there is no_traffic in this moment,1,2
i did and i sent the info on your screen drive carefully,bol_to_ave,1,1
what city are you interested in the forecast for,for what city would you like the forecast,3,3
it will snow in los_angeles tomorrow with a low of 70f and a high of 90f,for what city would you like the forecast,3,3
no problem,nearby,1,1
what city do you want the weather for,what city are you located in,3,3
it won t be overcast or cloudy at all this week in carson,there is no snow in the forecast for,2,1
you are welcome,ino,1,1
what city can i check for snow for you,what city are you located in so i could check to see if it will be snowing this week,3,3
snow is predicted to fall on saturday in alameda,ffic is being reported as heavy_traffic,1,1
you re welcome,braa_johns snow forecast is being reported as heavy_traffic,1,1
home is 5_miles away at 5671 barringer street,navigating you home,1,1
no the only route available has heavy_traffic i m sorry,i will find there then,2,1
sorry about it enjoy some music in the meantime,ave,1,1
what city are you inquiring about,which city do you want the weather for,3,3
what would you like to know about the weather in durham,what city do you want the weather for,3,3
the weekly forecast does not show that there will be a blizzard in durham this week,there is no weather on the route to durham,3,3
not a problem,there is no snow in the forecast for durham today,3,1
the nearest one is palo_alto_garage_r it s just 1_miles away,we re 6_miles away from dish_parking,4,3
you re welcome,you re welcome,5,5
your doctorappointment is scheduled for friday at 11am,your doctorappointment is at 1pm,4,3
for what day would you like to know,today in seattle it will be cold are you interested as well in other days weather forecast,2,3
this week in seattle the weather is forecasted to be overcast cloudy windy foggy drzzle warm and dry,what days are you interested in,2,1
you re welcome,traffic will be between 30f - 40f monday to wednesday and between 60f -,1,1
the_westin is 6_miles away,the nearest hotel is the_westin it s 4_miles away,3,3
navigating to the_westin,i sent on your screen the best route to reach there,4,1
the address is 329_el_camino_real,ln,1,1
you re welcome happy to be of assistance,ffic,1,1
your tennis_activity is on the_4th at 5pm and your sister will be attending,your tennis_activity is the_5th at 5pm,2,3
you re welcome,ino,1,1
your dinner is on tuesday with your sister,your sister will be in attendance at your dinner,2,1
you re welcome,lawyuled you re welcome,5,5
which appointment would you like the date for,your optometrist_appointment is on wednesday,3,2
it is not hailing in manhattan the forecast says it is dry today,innision_nearby manhattan is windy the low is 60f and the high is 70,1,1
any time,manhattan is windy the low is 60f and the high is 70f,2,1
for which one i have two one on the_8th at 11am and one on wednesday at 11am,your lab_appointment is on the_5th at 10am,3,1
you re welcome,you re welcome,5,5
taking you home,home is 1_miles away with moderate_traffic do you need the address,3,2
home is 5671_barringer_street anything else i can help you with,the address is 638_amherst_st would you like directions there,3,1
got it will do,the address is 638_amherst_st i sent the route on your screen,4,1
you re welcome i am always happy to help,you re welcome,5,5
you have two dentist_appointment one with your aunt and one with your sister both on monday,you have two dentist_appointment one on wednesday with jon and one on the_18,2,3
glad i can assist you,you have two dentist_appointment one on the_18th with ana,3,1
the one at 6pm with jon is on the_11th,your next dinner event is with your father on friday,4,1
glad i can help,you re welcome,5,1
what city do you want to hear the forecast for,what city can i give you today and tomorrow s forecast for,2,3
it will be overcast today and stormy tomorrow in mountain_view,traffic will be low of 30f and high of 40f today and tomorrow,1,1
you re welcome,lnx_traffic will be high of 50f tomorrow,1,1
chevron is 6_miles away,the nearest gas_station is chevron at 783_arcadia_pl,3,1
i m sorry chevron is the only gas_station i am able to locate,there is a chevron at 783_arcadia_pl,4,3
its address is 783_arcadia_pl i sent it on your screen,the closest gas_station is 8_miles away,5,2
you re welcome drive safely,ave,1,1
no problem,ave,1,1
saturday it will snow in fresno,it will not snow in fresno this week,4,3
glad to help,you re welcome,5,5
the nearest pizza_restaurant with no_traffic is 3_miles away at 113_anton_ct do you want to go to the round_table,dominos is at 776_arastradero_rd it is 4_miles away,3,3
you re welcome,radero_rd there is no_traffic setting directions now,2,1
for which one i have two one at 6pm and one at 3pm,for which one i have two one at 1pm on the_15th and one at 5pm,1,3
