original_response_(S1),predicted_response_(S2),Grammatically_correctness_of_S2 (scale 1-5),Similarity_between_S1_and_S2_in_terms_of_meaning_and_provided_info (scale 1-5)
jon and jeff will be attending your tennis_activity,you have two tennis_activity scheduled one on the_2nd at 9am with your mother and,3,1
they will be there at 1pm,uesday at 4pm with your aunt,1,1
you are welcome,you have two tennis_activity scheduled one on the_4th at 11am with your aunt,3,1
for what city are you interested in,what city are you interested in learning the forecast for,3,3
it will not be windy in cleveland next_week,the forecast for new_york predicts overcast skies with a low of 80f and a high,1,1
no problem,humid the low temperature will be 20f and a high of 90f,2,1
where are you interested in,what city would you like me to check the weather for,4,1
in camarillo it will be stormy on tuesday,it will not be stormy in camarillo this week,5,3
happy to help,ln,1,1
there aren t any cloudy days in the forecast for inglewood,it will not be cloudy in inglewood next_week,4,3
you re welcome,it will not be cloudy in inglewood next_week,4,1
the forecast says there will be snow in fresno there is no mention of clear_skies on wednesday,there will not be clear_skies in fresno on wednesday,3,3
you are welcome,lnasaanford_shopping_center is located at 773_alger_dr,3,1
there is no starbucks locally,i have no starbucks listed as close to you,2,3
teavana is 5_miles away at 145_amherst_st with moderate_traffic,the closest coffee shop is 6_miles away at 792_bedoin_street,3,1
the current route is the fastest one i can find,i have no starbucks listed as close to you,2,1
you re welcome,you re welcome,5,5
there is a chef_chu_s and a tai_pan,there is a p_.f_._changs 2_miles away,3,1
that would be chef_chu_s,real there is no_traffic on our way,1,1
chef_chu_s is at 593_arrowhead_way,real_york we should be there shortly,1,1
you re welcome,real_york is 6_miles away with no_traffic on our way,3,1
are you talking about the doctor_appointment on wednesday or the one on the_5th,springer_street is at 434_arastradero_rd with your brother,1,1
your doctor_appointment on wednesday is at 7pm with your father,springer_street is at 434_arastradero_rd with your brother,1,1
your doctor_appointment on the_5th is at 6pm with alex,springer_street is at 10_ames_street with your aunt,1,1
in what city are you interested,what city are you interested in knowing the forecast for,3,3
in los_angeles it will rain today and be 40f - 60f tomorrow it will be warm and 60f - 80f,in what city would you like the forecast,3,1
no problem,idsnicnicnicnicero_ave is scheduled to be cloudy today and cold tomorrow,1,1
there are whole_foods 2_miles away and sigona_farmers_market 4_miles away where do we go,we re 4_miles away from safeway but there is heavy_traffic in this moment,2,1
sigona_farmers_market is located 4_miles away with no_traffic it s located at 638_amherst_st,traffic and whole_foods which of these would you like,2,1
great glad i could help have a great day we will be there soon,store is 2_miles away with no_traffic,5,1
yoga is with alex at 11am,you have two yoga_activity scheduled one is at 9am with jeff and the other is at,3,2
you are welcome,ies with martha is that going to be a problem,1,1
jacks_house is at 864_almanor_ln,i have two friend listed which address would you like,1,1
taking you to jack s house,jill or tom,1,1
i sent all the info on your screen drive carefully,johnardoes or whole_foods,1,1
anytime,johnardoes or whole_foods,1,1
what city do you want to hear the forecast report from,for what city please,1,3
it will be stormy in camarillon on friday,it will not be foggy in camarillo on friday,3,2
you re welcome,camarillo is forecast to be cloudy on friday,3,1
you have a dentist_appointment on friday at 7pm,your dentist_appointment is monday at 7pm,4,3
you re welcome,you re welcome,5,5
your next tennis_activity is on the_4th at 5pm with your mother,your next tennis_activity is with jeff at 4pm do you need the date as well,3,3
glad i can help,scrutuled you have two tennis_activity scheduled one on the_4th with martha and one,2,1
we re 5_miles away from starbucks would you like to go there,there are 3 local cafe would you like the closest one,2,2
navigating you to starbucks,the closest cafe is teavana it is 2_miles away at 145_amherst,3,1
the address is 792_bedoin_street i sent the info on your screen drive carefully,the closest cafe is teavana,1,1
what city do you want the weather for,what city are you located in so i could check to see if it s cloudy outside today,3,3
there are no clouds in fresno right now,fresno s forecast does not predict cloudy skies today,2,2
anytime,inofficodgenic_ave and sunday in fresno,1,1
what location should i look up the weekly forecast for,what city do you want the weather for,3,2
it should not be hot in brentwood this week,it will be warm today and turn to rain tomorrow,2,1
you re welcome,bolusnicnicnic_traffic is predicted to be cloudy followed by warm weather with a low,1,1
okay which one i have one for the_12th at 9am and one for the_4th at 5pm,you have two optometrist_appointment scheduled one on the_4th at 10am with,3,1
you re welcome,lex and your father will be attending,3,1
your home is 4_miles away but there is heavy_traffic on our way i sent the best available route on your screen,home is 5_miles away at 5671_barringer_street,4,3
sure it s 56_cadwell_street you can see it on your screen,barringer_street is located at 481_amaranta_ave,4,1
you re welcome drive safely,barringer_street is 2_miles away with moderate_traffic,4,1
the football game is on thursday,the football game is friday at 11am,4,3
your appointment is for tuesday at 11am,your doctorappointment is on friday at 1pm,4,2
what city would you like to hear this weather information for,what city are you asking about,4,3
it will not snow in san_mateo this week,what city do you want the weather for,4,1
you re welcome,ave this week with highs in the 90s and lows in the 50s,1,1
your lab_appointment is on the_5th and your aunt will be attending,you have two lab_appointment scheduled one on the_5th with your sister and the other,1,4
the lab_appointment is schedule for 2pm on the_5th and your aunt will be attending,you re welcome,5,1
you re welcome,your sister is scheduled to go over the budget on the_15th with your sister,1,1
friday at 3pm,your next conference is this friday a 3pm,2,3
what city do you need the 2 day temperature for,which city would you like today and tomorrow s temperature for,3,1
in grand_rapids it will be 50f - 70f today and 20f - 40f tomorrow,it will be between 70f - 90f on monday and between 60f - 80f on,1,1
you re welcome,no problem,5,1
jills_house is located at 347_alta_mesa_ave,jill lives at 347_alta_mesa_ave,3,5
certainly setting navigation details now there s a car_collision_nearby so take care on the roads,jill s house,1,1
you re welcome,jill s house is 8_miles away with no_traffic on our way,3,1
the closest is pizza_chicago 5_miles away at 915_arbol_dr would you like directions there,the nearest pizza place is round_table located at 113_anton_ct you will find it at,2,3
here is the shortest route to pizza_chicago,the address is 8anton_ct i sent the quickest route on your screen,4,1
you re welcome,you re welcome the info are on the screen drive carefully,5,5
your home is at 56_cadwell_street,the closest home is 5_miles away at 5671_barringer_street,4,3
no problem,you re welcome and gps set,5,5
here are directions to cafe_venetia,the nearest cafe is teavana which is 1_miles away at 145_amherst,4,1
unfortunately there is heavy_traffic but it s just 2_miles away you should be able to reach it quickly anyway,the nearest cafe is teavana would you like directions there,4,1
269_alger_dr is the location of cafe_venetia,the nearest cafe is teavana,4,1
you re welcome,you re welcome,5,5
your next meeting is with your boss at 10am in conference_room_102,the meeting is in conference_room_100 at 10am on friday,5,3
you re welcome did you also want to know the agenda for the meeting,no problem,1,1
you are welcome,ave,1,1
stanford_express_care is on the way,there is no_traffic on our way to palo_alto_medical_foundation,4,1
navigating to stanford_express_care at 214_el_camino_real there is heavy_traffic on the way there however,there is no_traffic on our way to palo_alto_medical_foundation,4,1
you re very welcome,nearby,1,1
is there a specific day you would like me to check the weather in grand_rapids for,what can i tell you about grand_rapids weather,2,3
grand_rapids on friday will be windy between 60f - 70f,what would you like to know about the weather in grand_rapids,3,3
you are welcome,what would you like to know about the weather in grand_rapids,3,1
you re welcome,you re welcome,5,5
what city are you asking about,what city can i tell you the weather for,1,3
tomorrow will not be hot in atherton it will be dry low of 30f high of 50f,what city are you wanting to know the weather for,1,1
no problem,ero tea,1,1
would you prefer stanford_shopping_center which is 7_miles away with no_traffic or ravenswood_shopping_center which is 1_miles away with a road_block_nearby,we are 5_miles away from town_and_country does it sound good to you,4,2
setting directions to 434_arastradero_rd now,ffic would be between 40f - 60f on monday and between 60f - 80f on,1,1
you are welcome,hambra_farmers_market would you like to go there,4,1
your dinner is 5pm tonight,arbol_dr we re gonna get there shortly,4,1
there isn t any rain predicted to fall in redwood_city this week,it will not be raining this week in redwood_city,5,3
anytime,you re welcome,5,5
you have two meeting scheduled one at 4pm in conference_room_102 to discuss_the_company_picnic and one at 6pm in 100_conference_room to go over the quarterly report,the purpose of your meeting is to go over the budget your boss will be in attendance,3,1
you re welcome,team_view is at 3pm on friday,4,1
your meeting is scheduled for 2pm tomorrow the agenda is to discuss_the_merger,the meeting is at 3pm and the agenda is to gover over the budget,3,2
you are welcome,real meeting is at 4pm and the agenda is to gover over the budget,3,1
you are welcome,you re welcome,5,5
what day would you like the forcast for,it will be dry in redwood_city on monday,5,1
it will not be dry in redwood_city next_week,it will be dry in redwood_city on monday,5,5
you are welcome,traffic will be in redwood_city on tuesday,3,1
your doctor_appointment is on monday at 2pm,you have a doctorappointment set for friday at 2pm,3,3
we re 3_miles away from chef_chu_s and 6_miles away from mandarin_roots,there is a jing_jing and p_.f_._changs,1,1
chef_chu_s is closer,there is a car_collision_nearby but we re just 1_miles away it,2,1
chef_chu_s is located at 593_arrowhead_way,braffic on our way,1,1
chef_chu_s is 3_miles away through moderate_traffic,inese_collision_nearby,1,1
you re welcome,you re welcome,5,5
pizza_chicago is 2_miles away,the pizza_hut is at 704_el_camino_real it s just 1,1,3
the address is 915_arbol_dr would you like directions there,the closest pizza place in the area is philz,5,1
okay heading to pizza_chicago,hambra_bra_farmers_market and pizza_hut,1,3
we are 3_miles away from town and county shopping_center does it sound good to you,we are 5_miles away from stanford_shopping_center does it sound good,4,3
yes it is,center_farmers_market does it sound good to you,5,1
town_and_country is located at 383_university_ave,the closest shopping_center to you will be 8_miles away,5,3
have a good day,nearby but intrinsoesodgeodgenicheduled to be 30_ 40_bucksnichedoes,1,1
dew is predicted in danville on thursday,there will not be clear_skies in danville on thursday,5,2
anytime,idsheetursday,1,1
chef_chu_s is 5_miles away,no chinese_restaurant are within 5_miles but i have a panda_,1,1
there is currently no_traffic,panda_express is 3_miles away,5,1
gps set happy to assist you,bol_to_ave,1,1
i have located a parking_garage 2_miles away at 880_ames_ct called webster_garage,we re 1_miles away from dish_parking and 4_miles away from pal,3,1
it is located 2_miles away with moderate_traffic en route,parking predicts we will get there in about 5 minutes,5,1
no problem,centerffic noted on the route,1,1
okay what city should i look in,what city do you want to know if it will be cloudy in,3,3
during the week it will be cloudy in grand_rapids only today,it will be cloudy on tuesday in grand_rapids,3,3
glad i could help out,traffic will be cloudy on tuesday in grand_rapids,3,1
there are the ravenswood_shopping_center and the stanford_shopping_center both 3_miles away do you want me to flip a coin between them or will you pick where to go,town_and_country at 383_university_ave would you like the route put on the,1,1
navigating you to ravenswood_shopping_center,there is moderate_traffic on our way,3,1
the address to ravenswood_shopping_center is 434_arastradero_rd,rdrigood_way to stanford_shopping_center,1,2
good day,you re welcome,5,5
you have four yoga_activity scheduled one on monday with alex two on friday with sister and one with marie and one on the_17th with martha,you have two yoga_activity scheduled one on tuesday with alex and the other in the_,2,3
you are welcome,alex is on the_12th with marie which is at 9am,3,1
there is a chevron,there is a chevron 2_miles away,5,3
taking you to chevron,i sent the info on your screen you re welcome,5,1
783_arcadia_pl is the address for chevron gas_station,ero_alto_garage_r,1,1
you re welcome happy to help,veland_veland_parking is 4_miles away at 481_amaranta_,2,1
for what city,what city would you like to hear the 7 day forecast for,3,5
in downtown_chicago it will be humid on monday snow on tueday dry on wednesday frost on thursday drizzle on friday clear_skies on saturday and sunday,frost is predicted on monday with a low of 60f and a high of 70f,1,1
you are welcome,you re welcome,5,5
what location do you want me to check if it will be rainy,what city do you want to know if it will rain in,3,3
next_week it will rain on saturday in los_angeles,it will rain on sunday in los_angeles,5,3
anytime,it will rain on sunday in los_angeles,5,1
your boss will be at the meeting on monday at 1pm,your meeting is on wednesday at 7pm with the vice_president in conference_room_100,3,3
happy to help,ino,1,1
it will be dry wednesday in new_york,no it will not be dry in new_york on wednesday,5,1
no problem,realpton tea and ice on wednesday,1,1
durham does not have any snow predicted this week,snow is on the_3rd at 10am,1,1
you are welcome,you re welcome,5,5
the closest coffee place is coupa but there is heavy_traffic would you like a different location,there is moderate_traffic to starbucks now,4,2
starbucks at 792_bedoin_street is 3_miles away with no_traffic,there is no coffee nearby,2,2
sending you direction now,i sent the directions on your screen,5,5
you re welcome,i sent the directions on your screen,5,1
we re 3_miles away from willows_market but there is a car_collision_nearby,we re 4_miles away from safeway but there is heavy_traffic in this moment,3,3
i m sorry but there are no other options nearby,store is whole_foods which is 2_miles away,3,1
ok driver making a route to willows_market and avoiding the car accident,ffic,1,1
you are welcome driver,you re welcome,5,5
it will not drizzle in cleveland tomorrow,there should not be any drizzle in cleveland tomorrow,3,5
no problem,it will not be drizzle in cleveland tomorrow,3,1
the only nearby hospital is stanford_express_care which is 5_miles away,stanford_childrens_health is the only hospital that i can find it is located at 8,3,4
there is currently a road_block_nearby on the 5_miles route to stanford_express_care,stanford_childrens_health is the only hospital that i can find,3,3
the only route to stanford is reporting a road block but i am finding you the quickest route to 214_el_camino_real,stanford_childrens_health is the only hospital that i can find,3,1